id_cadeia;nucleo;qtd_municipios;qtd_sedes;tem_sede;utp_dominante;coesao_utp_perc;utps_envolvidas;diagnostico_geral
NUCLEO_0;Colorado do Oeste, Vilhena;7;2;Sim;759;57.1;463, 759;Cadeia Mista (Dominante: UTP 759)
NUCLEO_1;Guajará-Mirim, Nova Mamoré;2;1;Sim;143;100.0;143;Cadeia Coesa (100% interna)
NUCLEO_10;Feijó, Tarauacá;2;1;Sim;731;100.0;731;Cadeia Coesa (100% interna)
NUCLEO_100;São Francisco do Piauí, São José do Peixe;2;0;Não;617;100.0;617;Cadeia Coesa (100% interna)
NUCLEO_101;São Miguel do Fidalgo, Socorro do Piauí;2;0;Não;617;100.0;617;Cadeia Coesa (100% interna)
NUCLEO_102;Acaraú, Itarema;2;1;Sim;544;100.0;544;Cadeia Coesa (100% interna)
NUCLEO_103;Alcântaras, Moraújo;2;0;Não;325;100.0;325;Cadeia Coesa (100% interna)
NUCLEO_104;Amontada, Itapipoca;4;0;Não;544;75.0;544, 685;Cadeia Mista (Dominante: UTP 544)
NUCLEO_105;Apuiarés, Pentecoste;2;0;Não;685;100.0;685;Cadeia Coesa (100% interna)
NUCLEO_106;Araripe, Assaré;3;0;Não;188;66.7;188, 255;Cadeia Crítica (Núcleo Cross-UTP: 255, 188)
NUCLEO_107;Aratuba, Itapiúna;2;0;Não;NOVA25;100.0;NOVA25;Cadeia Coesa (100% interna)
NUCLEO_108;Barbalha, Juazeiro do Norte;8;1;Sim;187;100.0;187;Cadeia Coesa (100% interna)
NUCLEO_109;Barro, Mauriti;2;0;Não;675;100.0;675;Cadeia Coesa (100% interna)
NUCLEO_11;Rio Branco, Senador Guiomard;7;1;Sim;282;100.0;282;Cadeia Coesa (100% interna)
NUCLEO_110;Brejo Santo, Porteiras;4;0;Não;675;100.0;675;Cadeia Coesa (100% interna)
NUCLEO_111;Caucaia, Fortaleza;16;1;Sim;111;93.8;111, 166;Cadeia Mista (Dominante: UTP 111)
NUCLEO_112;Cruz, Jijoca de Jericoacoara;4;1;Sim;557;100.0;557;Cadeia Coesa (100% interna)
NUCLEO_113;Iguatu, Quixelô;12;1;Sim;188;75.0;188, 550;Cadeia Mista (Dominante: UTP 188)
NUCLEO_114;Itapajé, Umirim;4;0;Não;685;100.0;685;Cadeia Coesa (100% interna)
NUCLEO_115;Limoeiro do Norte, Russas;7;2;Sim;674;57.1;319, 388, 674;Cadeia Crítica (Núcleo Cross-UTP: 319, 674)
NUCLEO_116;Meruoca, Sobral;14;1;Sim;325;100.0;325;Cadeia Coesa (100% interna)
NUCLEO_117;Nova Russas, Tamboril;9;3;Sim;728;44.4;487, 693, 728;Cadeia Mista (Dominante: UTP 728)
NUCLEO_118;Novo Oriente, Quiterianópolis;2;0;Não;487;100.0;487;Cadeia Coesa (100% interna)
NUCLEO_119;Parambu, Tauá;6;2;Sim;733;83.3;410, 733;Cadeia Mista (Dominante: UTP 733)
NUCLEO_12;Alvarães, Tefé;2;1;Sim;734;100.0;734;Cadeia Coesa (100% interna)
NUCLEO_120;Quixadá, Quixeramobim;9;1;Sim;719;66.7;188, 410, 719;Cadeia Mista (Dominante: UTP 719)
NUCLEO_121;Angicos, Jardim de Angicos;9;1;Sim;554;44.4;220, 554, NOVA24;Cadeia Mista (Dominante: UTP 554)
NUCLEO_122;Carnaubais, Pendências;3;0;Não;220;100.0;220;Cadeia Coesa (100% interna)
NUCLEO_123;Cruzeta, São José do Seridó;5;0;Não;NOVA24;60.0;99, NOVA24;Cadeia Crítica (Núcleo Cross-UTP: 99, NOVA24)
NUCLEO_124;Currais Novos, São Vicente;6;1;Sim;99;100.0;99;Cadeia Coesa (100% interna)
NUCLEO_125;Parnamirim, Natal;11;1;Sim;222;100.0;222;Cadeia Coesa (100% interna)
NUCLEO_126;Encanto, Pau dos Ferros;19;1;Sim;631;89.5;220, 319, 631;Cadeia Mista (Dominante: UTP 631)
NUCLEO_127;Grossos, Mossoró;22;1;Sim;220;100.0;220;Cadeia Coesa (100% interna)
NUCLEO_128;Guamaré, Macau;3;1;Sim;61;100.0;61;Cadeia Coesa (100% interna)
NUCLEO_129;Ipueira, São João do Sabugi;2;0;Não;NOVA24;100.0;NOVA24;Cadeia Coesa (100% interna)
NUCLEO_13;Benjamin Constant, Tabatinga;3;1;Sim;155;100.0;155;Cadeia Coesa (100% interna)
NUCLEO_130;Jardim do Seridó, Parelhas;7;1;Sim;NOVA24;71.4;65, NOVA24;Cadeia Crítica (Núcleo Cross-UTP: NOVA24, 65)
NUCLEO_131;Lagoa de Velhos, Sítio Novo;2;0;Não;99;100.0;99;Cadeia Coesa (100% interna)
NUCLEO_132;Nísia Floresta, São José de Mipibu;2;0;Não;222;100.0;222;Cadeia Coesa (100% interna)
NUCLEO_133;São Miguel, Venha-Ver;7;0;Não;631;71.4;550, 631;Cadeia Mista (Dominante: UTP 631)
NUCLEO_134;Baraúna, Picuí;4;0;Não;NOVA10;100.0;NOVA10;Cadeia Coesa (100% interna)
NUCLEO_135;Cabedelo, João Pessoa;8;1;Sim;185;100.0;185;Cadeia Coesa (100% interna)
NUCLEO_136;Campina Grande, Massaranduba;13;1;Sim;65;100.0;65;Cadeia Coesa (100% interna)
NUCLEO_137;Conceição, Santa Inês;4;1;Sim;477;75.0;244, 477;Cadeia Mista (Dominante: UTP 477)
NUCLEO_138;Cubati, Pedra Lavrada;2;0;Não;65;100.0;65;Cadeia Coesa (100% interna)
NUCLEO_139;Marizópolis, Sousa;8;1;Sim;704;100.0;704;Cadeia Coesa (100% interna)
NUCLEO_14;Iranduba, Manaus;10;1;Sim;206;100.0;206;Cadeia Coesa (100% interna)
NUCLEO_140;Monteiro, São João do Cariri;10;1;Sim;595;100.0;595;Cadeia Coesa (100% interna)
NUCLEO_141;Patos, São José do Bonfim;18;1;Sim;244;100.0;244;Cadeia Coesa (100% interna)
NUCLEO_142;Piancó, Santana dos Garrotes;11;1;Sim;543;100.0;543;Cadeia Coesa (100% interna)
NUCLEO_143;Pombal, São Domingos;8;0;Não;NOVA24;50.0;220, 631, NOVA24;Cadeia Mista (Dominante: UTP NOVA24)
NUCLEO_144;Princesa Isabel, São José de Princesa;3;0;Não;321;100.0;321;Cadeia Coesa (100% interna)
NUCLEO_145;Afogados da Ingazeira, Iguaracy;10;0;Não;321;60.0;321, 595;Cadeia Crítica (Núcleo Cross-UTP: 321, 595)
NUCLEO_146;Altinho, Cachoeirinha;4;0;Não;78;75.0;113, 78;Cadeia Crítica (Núcleo Cross-UTP: 78, 113)
NUCLEO_147;Araripina, Trindade;9;1;Sim;27;88.9;27, 675;Cadeia Mista (Dominante: UTP 27)
NUCLEO_148;Arcoverde, Sertânia;3;1;Sim;59;100.0;59;Cadeia Coesa (100% interna)
NUCLEO_149;Barreiros, Tamandaré;5;0;Não;209;100.0;209;Cadeia Coesa (100% interna)
NUCLEO_15;Itapiranga, Silves;3;1;Sim;540;100.0;540;Cadeia Coesa (100% interna)
NUCLEO_150;Belo Jardim, Sanharó;3;0;Não;78;100.0;78;Cadeia Coesa (100% interna)
NUCLEO_151;Bom Conselho, Terezinha;5;0;Não;113;80.0;113, 531;Cadeia Mista (Dominante: UTP 113)
NUCLEO_152;Brejo da Madre de Deus, Santa Cruz do Capibaribe;7;0;Não;78;71.4;595, 65, 78;Cadeia Mista (Dominante: UTP 78)
NUCLEO_153;Canhotinho, Quipapá;3;0;Não;113;33.3;113, 78, NOVA2;Cadeia Crítica (Núcleo Cross-UTP: 113, NOVA2)
NUCLEO_154;Caruaru, Riacho das Almas;13;1;Sim;78;92.3;59, 78;Cadeia Mista (Dominante: UTP 78)
NUCLEO_155;Cupira, Lagoa dos Gatos;2;0;Não;78;100.0;78;Cadeia Coesa (100% interna)
NUCLEO_156;Custódia, Flores;2;0;Não;321;100.0;321;Cadeia Coesa (100% interna)
NUCLEO_157;Escada, Primavera;3;0;Não;78;100.0;78;Cadeia Coesa (100% interna)
NUCLEO_158;Garanhuns, São João;14;1;Sim;113;100.0;113;Cadeia Coesa (100% interna)
NUCLEO_159;Itaíba, Manari;4;1;Sim;531;100.0;531;Cadeia Coesa (100% interna)
NUCLEO_16;Caracaraí, Iracema;2;1;Sim;451;100.0;451;Cadeia Coesa (100% interna)
NUCLEO_160;Jaboatão dos Guararapes, Recife;11;1;Sim;278;100.0;278;Cadeia Coesa (100% interna)
NUCLEO_161;Macaparana, São Vicente Férrer;5;0;Não;162;100.0;162;Cadeia Coesa (100% interna)
NUCLEO_162;Pedra, Venturosa;2;0;Não;59;100.0;59;Cadeia Coesa (100% interna)
NUCLEO_163;Pesqueira, Poção;2;1;Sim;635;100.0;635;Cadeia Coesa (100% interna)
NUCLEO_164;Petrolina, Juazeiro;8;1;Sim;253;100.0;253;Cadeia Coesa (100% interna)
NUCLEO_165;Pombos, Vitória de Santo Antão;3;0;Não;78;100.0;78;Cadeia Coesa (100% interna)
NUCLEO_166;Salgueiro, Serrita;10;1;Sim;675;100.0;675;Cadeia Coesa (100% interna)
NUCLEO_167;São José da Coroa Grande, Maragogi;4;1;Sim;209;100.0;209;Cadeia Coesa (100% interna)
NUCLEO_168;Serra Talhada, Triunfo;12;1;Sim;321;100.0;321;Cadeia Coesa (100% interna)
NUCLEO_169;Surubim, Vertente do Lério;7;0;Não;78;85.7;65, 78;Cadeia Mista (Dominante: UTP 78)
NUCLEO_17;Almeirim, Prainha;2;0;Não;375;50.0;375, 592;Cadeia Crítica (Núcleo Cross-UTP: 375, 592)
NUCLEO_170;Arapiraca, Taquarana;14;1;Sim;22;92.9;22, NOVA19;Cadeia Mista (Dominante: UTP 22)
NUCLEO_171;Carneiros, São José da Tapera;2;0;Não;690;100.0;690;Cadeia Coesa (100% interna)
NUCLEO_172;Delmiro Gouveia, Pariconha;3;1;Sim;NOVA18;100.0;NOVA18;Cadeia Coesa (100% interna)
NUCLEO_173;Estrela de Alagoas, Palmeira dos Índios;3;1;Sim;NOVA19;100.0;NOVA19;Cadeia Coesa (100% interna)
NUCLEO_174;Inhapi, Mata Grande;3;0;Não;NOVA18;100.0;NOVA18;Cadeia Coesa (100% interna)
NUCLEO_175;Maceió, Rio Largo;11;1;Sim;203;100.0;203;Cadeia Coesa (100% interna)
NUCLEO_176;Maravilha, Ouro Branco;2;0;Não;690;50.0;531, 690;Cadeia Crítica (Núcleo Cross-UTP: 690, 531)
NUCLEO_177;Olho d'Água do Casado, Piranhas;2;0;Não;NOVA18;100.0;NOVA18;Cadeia Coesa (100% interna)
NUCLEO_178;Palestina, Pão de Açúcar;4;1;Sim;NOVA22;75.0;690, NOVA22;Cadeia Mista (Dominante: UTP NOVA22)
NUCLEO_179;Passo de Camaragibe, São Luís do Quitunde;4;0;Não;209;75.0;209, NOVA2;Cadeia Mista (Dominante: UTP 209)
NUCLEO_18;Altamira, Brasil Novo;5;2;Sim;375;80.0;375, 747;Cadeia Mista (Dominante: UTP 375)
NUCLEO_180;Penedo, Neópolis;4;1;Sim;NOVA17;100.0;NOVA17;Cadeia Coesa (100% interna)
NUCLEO_181;Poço das Trincheiras, Santana do Ipanema;8;1;Sim;690;100.0;690;Cadeia Coesa (100% interna)
NUCLEO_182;Aracaju, Nossa Senhora do Socorro;4;1;Sim;19;100.0;19;Cadeia Coesa (100% interna)
NUCLEO_183;Brejo Grande, Pacatuba;5;0;Não;NOVA17;100.0;NOVA17;Cadeia Coesa (100% interna)
NUCLEO_184;Canindé de São Francisco, Poço Redondo;4;0;Não;246;50.0;246, 276;Cadeia Crítica (Núcleo Cross-UTP: 246, 276)
NUCLEO_185;Itabaiana, Macambira;9;0;Não;276;66.7;276, 367;Cadeia Crítica (Núcleo Cross-UTP: 276, 367)
NUCLEO_186;Itabaianinha, Umbaúba;10;0;Não;367;60.0;367, 469;Cadeia Crítica (Núcleo Cross-UTP: 469, 367)
NUCLEO_187;Lagarto, Salgado;5;1;Sim;367;100.0;367;Cadeia Coesa (100% interna)
NUCLEO_188;Malhada dos Bois, São Francisco;2;0;Não;NOVA17;100.0;NOVA17;Cadeia Coesa (100% interna)
NUCLEO_189;Simão Dias, Paripiranga;5;0;Não;367;100.0;367;Cadeia Coesa (100% interna)
NUCLEO_19;Ananindeua, Belém;6;1;Sim;41;100.0;41;Cadeia Coesa (100% interna)
NUCLEO_190;Tobias Barreto, Itapicuru;3;1;Sim;469;66.7;469, 739;Cadeia Mista (Dominante: UTP 469)
NUCLEO_191;Acajutiba, Aporá;4;0;Não;7;100.0;7;Cadeia Coesa (100% interna)
NUCLEO_192;Alcobaça, Teixeira de Freitas;12;1;Sim;334;91.7;334, 370;Cadeia Mista (Dominante: UTP 334)
NUCLEO_193;Antas, Sítio do Quinto;4;0;Não;739;75.0;246, 739;Cadeia Mista (Dominante: UTP 739)
NUCLEO_194;Baixa Grande, Macajuba;2;1;Sim;603;100.0;603;Cadeia Coesa (100% interna)
NUCLEO_195;Barra, Xique-Xique;2;1;Sim;764;100.0;764;Cadeia Coesa (100% interna)
NUCLEO_196;Barra do Choça, Vitória da Conquista;24;2;Sim;362;79.2;362, 373, 542, 545, 581;Cadeia Mista (Dominante: UTP 362)
NUCLEO_197;Barreiras, Luís Eduardo Magalhães;16;2;Sim;38;62.5;38, 727;Cadeia Mista (Dominante: UTP 38)
NUCLEO_198;Bom Jesus da Lapa, Serra do Ramalho;2;1;Sim;296;100.0;296;Cadeia Coesa (100% interna)
NUCLEO_199;Boquira, Macaúbas;4;1;Sim;415;100.0;415;Cadeia Coesa (100% interna)
NUCLEO_2;Jaru, Governador Jorge Teixeira;8;1;Sim;395;87.5;182, 395;Cadeia Crítica (Núcleo Cross-UTP: 182, 395)
NUCLEO_20;Aurora do Pará, Mãe do Rio;5;1;Sim;737;60.0;626, 737, 80;Cadeia Crítica (Núcleo Cross-UTP: 626, 80)
NUCLEO_200;Brejões, Nova Itarana;3;1;Sim;54;100.0;54;Cadeia Coesa (100% interna)
NUCLEO_201;Brotas de Macaúbas, Ipupiara;2;0;Não;415;100.0;415;Cadeia Coesa (100% interna)
NUCLEO_202;Buritirama, Mansidão;2;1;Sim;424;100.0;424;Cadeia Coesa (100% interna)
NUCLEO_203;Cairu, Valença;7;1;Sim;350;85.7;350, 93;Cadeia Mista (Dominante: UTP 350)
NUCLEO_204;Caldeirão Grande, Saúde;3;0;Não;548;66.7;548, 708;Cadeia Crítica (Núcleo Cross-UTP: 708, 548)
NUCLEO_205;Canápolis, Santana;2;0;Não;296;100.0;296;Cadeia Coesa (100% interna)
NUCLEO_206;Capim Grosso, São José do Jacuípe;5;1;Sim;708;80.0;603, 708;Cadeia Mista (Dominante: UTP 708)
NUCLEO_207;Central, Uibaí;3;0;Não;538;66.7;538, 764;Cadeia Mista (Dominante: UTP 538)
NUCLEO_208;Conceição do Coité, Serrinha;8;1;Sim;752;75.0;506, 739, 752;Cadeia Mista (Dominante: UTP 752)
NUCLEO_209;Correntina, Santa Maria da Vitória;5;0;Não;296;80.0;296, 471;Cadeia Mista (Dominante: UTP 296)
NUCLEO_21;Belterra, Santarém;3;1;Sim;298;100.0;298;Cadeia Coesa (100% interna)
NUCLEO_210;Entre Rios, Esplanada;3;0;Não;7;100.0;7;Cadeia Coesa (100% interna)
NUCLEO_211;Euclides da Cunha, Monte Santo;4;1;Sim;506;100.0;506;Cadeia Coesa (100% interna)
NUCLEO_212;Eunápolis, Itabela;7;1;Sim;106;85.7;106, 542;Cadeia Mista (Dominante: UTP 106)
NUCLEO_213;Fátima, Heliópolis;3;0;Não;739;100.0;739;Cadeia Coesa (100% interna)
NUCLEO_214;Glória, Paulo Afonso;5;1;Sim;246;100.0;246;Cadeia Coesa (100% interna)
NUCLEO_215;Guanambi, Palmas de Monte Alto;19;2;Sim;520;68.4;455, 520, 627, 667;Cadeia Mista (Dominante: UTP 520)
NUCLEO_216;Iaçu, Itaberaba;5;1;Sim;539;100.0;539;Cadeia Coesa (100% interna)
NUCLEO_217;Ibicoara, Ituaçu;2;0;Não;545;50.0;545, 667;Cadeia Crítica (Núcleo Cross-UTP: 545, 667)
NUCLEO_218;Ibotirama, Muquém do São Francisco;3;1;Sim;533;100.0;533;Cadeia Coesa (100% interna)
NUCLEO_219;Igaporã, Riacho de Santana;2;0;Não;520;50.0;296, 520;Cadeia Crítica (Núcleo Cross-UTP: 520, 296)
NUCLEO_22;Bragança, Viseu;4;2;Sim;52;75.0;52, 761;Cadeia Crítica (Núcleo Cross-UTP: 52, 761)
NUCLEO_220;Igrapiúna, Ituberá;3;0;Não;350;100.0;350;Cadeia Coesa (100% interna)
NUCLEO_221;Ilhéus, Itabuna;25;1;Sim;126;100.0;126;Cadeia Coesa (100% interna)
NUCLEO_222;Irecê, Lapão;16;1;Sim;538;81.2;538, 599, 726;Cadeia Mista (Dominante: UTP 538)
NUCLEO_223;Itaeté, Mucugê;2;0;Não;602;100.0;602;Cadeia Coesa (100% interna)
NUCLEO_224;Itaparica, Vera Cruz;2;1;Sim;360;100.0;360;Cadeia Coesa (100% interna)
NUCLEO_225;Itapetinga, Itororó;4;1;Sim;542;100.0;542;Cadeia Coesa (100% interna)
NUCLEO_226;Lauro de Freitas, Salvador;11;1;Sim;291;100.0;291;Cadeia Coesa (100% interna)
NUCLEO_227;Livramento de Nossa Senhora, Paramirim;13;2;Sim;627;69.2;362, 520, 627, 667;Cadeia Mista (Dominante: UTP 627)
NUCLEO_228;Mairi, Várzea da Roça;2;0;Não;708;100.0;708;Cadeia Coesa (100% interna)
NUCLEO_229;Maracás, Planaltino;15;2;Sim;181;53.3;181, 581, 93;Cadeia Mista (Dominante: UTP 181)
NUCLEO_23;Cachoeira do Arari, Muaná;2;0;Não;NOVA6;100.0;NOVA6;Cadeia Coesa (100% interna)
NUCLEO_230;Mucuri, Nova Viçosa;2;1;Sim;453;100.0;453;Cadeia Coesa (100% interna)
NUCLEO_231;Mundo Novo, Piritiba;2;0;Não;603;50.0;548, 603;Cadeia Crítica (Núcleo Cross-UTP: 603, 548)
NUCLEO_232;Paratinga, Sítio do Mato;2;0;Não;296;100.0;296;Cadeia Coesa (100% interna)
NUCLEO_233;Pilão Arcado, Remanso;2;1;Sim;664;100.0;664;Cadeia Coesa (100% interna)
NUCLEO_234;Porto Seguro, Santa Cruz Cabrália;3;1;Sim;268;66.7;106, 268;Cadeia Mista (Dominante: UTP 268)
NUCLEO_235;Queimadas, Santaluz;5;1;Sim;594;80.0;594, 752;Cadeia Crítica (Núcleo Cross-UTP: 594, 752)
NUCLEO_236;Santo Antônio de Jesus, Varzedo;14;1;Sim;93;100.0;93;Cadeia Coesa (100% interna)
NUCLEO_237;Serra Dourada, Tabocas do Brejo Velho;3;0;Não;296;66.7;296, 533;Cadeia Mista (Dominante: UTP 296)
NUCLEO_238;Serrolândia, Várzea do Poço;2;0;Não;548;100.0;548;Cadeia Coesa (100% interna)
NUCLEO_239;Tapiramutá, Utinga;3;1;Sim;749;100.0;749;Cadeia Coesa (100% interna)
NUCLEO_24;Cametá, Limoeiro do Ajuru;2;1;Sim;64;100.0;64;Cadeia Coesa (100% interna)
NUCLEO_240;Abre Campo, Matipó;4;0;Não;214;100.0;214;Cadeia Coesa (100% interna)
NUCLEO_241;Águas Vermelhas, Divisa Alegre;2;0;Não;634;100.0;634;Cadeia Coesa (100% interna)
NUCLEO_242;Aimorés, Baixo Guandu;3;0;Não;92;100.0;92;Cadeia Coesa (100% interna)
NUCLEO_243;Além Paraíba, Sapucaia;4;0;Não;8;75.0;345, 8;Cadeia Crítica (Núcleo Cross-UTP: 8, 345)
NUCLEO_244;Alvorada de Minas, Serro;6;1;Sim;721;83.3;479, 721;Cadeia Mista (Dominante: UTP 721)
NUCLEO_245;Cachoeira de Pajeú, Pedra Azul;2;1;Sim;634;100.0;634;Cadeia Coesa (100% interna)
NUCLEO_246;Andrelândia, São Vicente de Minas;2;0;Não;83;50.0;309, 83;Cadeia Crítica (Núcleo Cross-UTP: 83, 309)
NUCLEO_247;Araguari, Uberlândia;21;4;Sim;351;42.9;21, 261, 29, 351, 352;Cadeia Crítica (Núcleo Cross-UTP: 21, 352)
NUCLEO_248;Araújos, Perdigão;2;0;Não;227;50.0;102, 227;Cadeia Crítica (Núcleo Cross-UTP: 227, 102)
NUCLEO_249;Astolfo Dutra, Dona Euzébia;2;0;Não;189;50.0;189, 8;Cadeia Crítica (Núcleo Cross-UTP: 189, 8)
NUCLEO_25;Capanema, Primavera;5;0;Não;52;60.0;52, 761, 80;Cadeia Mista (Dominante: UTP 52)
NUCLEO_250;Bambuí, Medeiros;4;0;Não;645;75.0;227, 645;Cadeia Mista (Dominante: UTP 645)
NUCLEO_251;Barão de Cocais, Santa Bárbara;2;0;Não;42;100.0;42;Cadeia Coesa (100% interna)
NUCLEO_252;Belo Horizonte, Contagem;27;1;Sim;42;96.3;169, 42;Cadeia Mista (Dominante: UTP 42)
NUCLEO_253;Belo Vale, Moeda;2;0;Não;42;100.0;42;Cadeia Coesa (100% interna)
NUCLEO_254;Bocaiúva, Engenheiro Navarro;16;1;Sim;218;100.0;218;Cadeia Coesa (100% interna)
NUCLEO_255;Bom Jesus do Galho, Pingo-d'Água;3;0;Não;157;100.0;157;Cadeia Coesa (100% interna)
NUCLEO_256;Buenópolis, Joaquim Felício;3;0;Não;101;100.0;101;Cadeia Coesa (100% interna)
NUCLEO_257;Buritizeiro, Pirapora;5;1;Sim;257;100.0;257;Cadeia Coesa (100% interna)
NUCLEO_258;Cabeceira Grande, Unaí;2;1;Sim;744;100.0;744;Cadeia Coesa (100% interna)
NUCLEO_259;Caldas, Poços de Caldas;8;1;Sim;262;100.0;262;Cadeia Coesa (100% interna)
NUCLEO_26;Castanhal, Santa Izabel do Pará;2;0;Não;41;100.0;41;Cadeia Coesa (100% interna)
NUCLEO_260;Cantagalo, Peçanha;2;0;Não;521;50.0;521, 684;Cadeia Crítica (Núcleo Cross-UTP: 521, 684)
NUCLEO_261;Carmo de Minas, São Lourenço;8;2;Sim;313;62.5;313, 83;Cadeia Mista (Dominante: UTP 313)
NUCLEO_262;Cataguases, Santana de Cataguases;3;0;Não;8;66.7;221, 8;Cadeia Crítica (Núcleo Cross-UTP: 8, 221)
NUCLEO_263;Centralina, Itumbiara;8;1;Sim;171;87.5;171, 422;Cadeia Mista (Dominante: UTP 171)
NUCLEO_264;Conceição do Mato Dentro, Dom Joaquim;2;1;Sim;479;100.0;479;Cadeia Coesa (100% interna)
NUCLEO_265;Congonhas, Conselheiro Lafaiete;13;0;Não;94;69.2;309, 35, 94;Cadeia Mista (Dominante: UTP 94)
NUCLEO_266;Coroaci, Virgolândia;2;0;Não;118;100.0;118;Cadeia Coesa (100% interna)
NUCLEO_267;Coronel Fabriciano, Ipatinga;13;1;Sim;157;100.0;157;Cadeia Coesa (100% interna)
NUCLEO_268;Cristália, Grão Mogol;2;0;Não;676;100.0;676;Cadeia Coesa (100% interna)
NUCLEO_269;Datas, Gouveia;5;1;Sim;104;80.0;104, 721;Cadeia Crítica (Núcleo Cross-UTP: 721, 104)
NUCLEO_27;Colares, Vigia;3;0;Não;80;100.0;80;Cadeia Coesa (100% interna)
NUCLEO_270;Descoberto, São João Nepomuceno;4;1;Sim;44;100.0;44;Cadeia Coesa (100% interna)
NUCLEO_271;Dionísio, São José do Goiabal;2;0;Não;157;100.0;157;Cadeia Coesa (100% interna)
NUCLEO_272;Durandé, Martins Soares;2;0;Não;214;100.0;214;Cadeia Coesa (100% interna)
NUCLEO_273;Elói Mendes, Varginha;13;1;Sim;358;69.2;358, 438, 83;Cadeia Mista (Dominante: UTP 358)
NUCLEO_274;Espera Feliz, Dores do Rio Preto;6;0;Não;221;50.0;214, 221, 49, 58;Cadeia Crítica (Núcleo Cross-UTP: 221, 58)
NUCLEO_275;Eugenópolis, Muriaé;13;2;Sim;221;76.9;221, 8;Cadeia Mista (Dominante: UTP 221)
NUCLEO_276;Fruta de Leite, Novorizonte;2;0;Não;676;50.0;669, 676;Cadeia Crítica (Núcleo Cross-UTP: 676, 669)
NUCLEO_277;Frutal, Itapagipe;3;1;Sim;261;100.0;261;Cadeia Coesa (100% interna)
NUCLEO_278;Guanhães, Sabinópolis;6;1;Sim;521;100.0;521;Cadeia Coesa (100% interna)
NUCLEO_279;Ijaci, Lavras;12;1;Sim;195;100.0;195;Cadeia Coesa (100% interna)
NUCLEO_28;Curionópolis, Parauapebas;4;1;Sim;237;100.0;237;Cadeia Coesa (100% interna)
NUCLEO_280;Inconfidentes, Ouro Fino;3;0;Não;270;66.7;270, 5;Cadeia Crítica (Núcleo Cross-UTP: 270, 5)
NUCLEO_281;Indaiabira, São João do Paraíso;3;0;Não;669;100.0;669;Cadeia Coesa (100% interna)
NUCLEO_282;Itabirinha, Mendes Pimentel;3;0;Não;118;100.0;118;Cadeia Coesa (100% interna)
NUCLEO_283;Itacarambi, Jaíba;4;0;Não;552;50.0;176, 552;Cadeia Crítica (Núcleo Cross-UTP: 552, 176)
NUCLEO_284;Itajubá, Maria da Fé;8;1;Sim;161;100.0;161;Cadeia Coesa (100% interna)
NUCLEO_285;Itanhandu, Pouso Alto;8;1;Sim;271;62.5;271, 313;Cadeia Mista (Dominante: UTP 271)
NUCLEO_286;Iturama, Ouroeste;8;0;Não;108;75.0;108, 175;Cadeia Mista (Dominante: UTP 108)
NUCLEO_287;Janaúba, Porteirinha;6;1;Sim;176;100.0;176;Cadeia Coesa (100% interna)
NUCLEO_288;Januária, Pedras de Maria da Cruz;3;1;Sim;552;100.0;552;Cadeia Coesa (100% interna)
NUCLEO_289;Jesuânia, Lambari;4;0;Não;358;50.0;270, 358, 83;Cadeia Mista (Dominante: UTP 358)
NUCLEO_29;Garrafão do Norte, Nova Esperança do Piriá;2;0;Não;52;100.0;52;Cadeia Coesa (100% interna)
NUCLEO_290;João Monlevade, Rio Piracicaba;5;1;Sim;184;100.0;184;Cadeia Coesa (100% interna)
NUCLEO_291;Juiz de Fora, Matias Barbosa;31;2;Sim;189;71.0;189, 35;Cadeia Mista (Dominante: UTP 189)
NUCLEO_292;Lagoa da Prata, Santo Antônio do Monte;6;0;Não;227;50.0;102, 227, 401;Cadeia Crítica (Núcleo Cross-UTP: 401, 102)
NUCLEO_293;Lagoa Formosa, Patos de Minas;12;1;Sim;243;75.0;243, 29, 352;Cadeia Mista (Dominante: UTP 243)
NUCLEO_294;Lajinha, Ibatiba;5;0;Não;214;80.0;214, 58;Cadeia Mista (Dominante: UTP 214)
NUCLEO_295;Lamim, Rio Espera;3;0;Não;94;100.0;94;Cadeia Coesa (100% interna)
NUCLEO_296;Machado, Paraguaçu;7;0;Não;270;57.1;262, 270, 358;Cadeia Crítica (Núcleo Cross-UTP: 262, 358)
NUCLEO_297;Manga, Matias Cardoso;2;0;Não;591;50.0;176, 591;Cadeia Crítica (Núcleo Cross-UTP: 591, 176)
NUCLEO_298;Manhuaçu, Reduto;11;1;Sim;214;100.0;214;Cadeia Coesa (100% interna)
NUCLEO_299;Mariana, Ouro Preto;4;1;Sim;94;100.0;94;Cadeia Coesa (100% interna)
NUCLEO_3;Ji-Paraná, Presidente Médici;7;1;Sim;182;85.7;182, 670;Cadeia Mista (Dominante: UTP 182)
NUCLEO_30;Irituia, São Miguel do Guamá;3;0;Não;80;100.0;80;Cadeia Coesa (100% interna)
NUCLEO_300;Mato Verde, Monte Azul;7;0;Não;176;71.4;176, 520;Cadeia Mista (Dominante: UTP 176)
NUCLEO_301;Morro do Pilar, Santo Antônio do Rio Abaixo;3;0;Não;158;100.0;158;Cadeia Coesa (100% interna)
NUCLEO_302;Nanuque, Serra dos Aimorés;2;1;Sim;769;100.0;769;Cadeia Coesa (100% interna)
NUCLEO_303;Nova Módica, Pescador;2;0;Não;335;100.0;335;Cadeia Coesa (100% interna)
NUCLEO_304;Novo Cruzeiro, Setubinha;2;0;Não;450;100.0;450;Cadeia Coesa (100% interna)
NUCLEO_305;Passos, São João Batista do Glória;5;1;Sim;241;100.0;241;Cadeia Coesa (100% interna)
NUCLEO_306;Patis, São João da Ponte;4;0;Não;218;75.0;218, 552;Cadeia Mista (Dominante: UTP 218)
NUCLEO_307;Pintópolis, São Francisco;5;2;Sim;197;80.0;197, 417;Cadeia Mista (Dominante: UTP 197)
NUCLEO_308;Planura, Colômbia;2;0;Não;261;50.0;261, 39;Cadeia Crítica (Núcleo Cross-UTP: 261, 39)
NUCLEO_309;Poté, Teófilo Otoni;16;1;Sim;335;93.8;335, 634;Cadeia Mista (Dominante: UTP 335)
NUCLEO_31;Itupiranga, Marabá;11;1;Sim;208;90.9;208, 781;Cadeia Mista (Dominante: UTP 208)
NUCLEO_310;Pouso Alegre, Santa Rita do Sapucaí;22;1;Sim;270;81.8;161, 270, 63;Cadeia Mista (Dominante: UTP 270)
NUCLEO_311;Prudente de Morais, Sete Lagoas;6;2;Sim;323;66.7;213, 323;Cadeia Mista (Dominante: UTP 323)
NUCLEO_312;Raul Soares, São Pedro dos Ferros;3;0;Não;265;100.0;265;Cadeia Coesa (100% interna)
NUCLEO_313;Rio Paranaíba, São Gotardo;7;1;Sim;702;100.0;702;Cadeia Coesa (100% interna)
NUCLEO_314;Rio Pomba, Tabuleiro;5;0;Não;189;60.0;189, 349, 35;Cadeia Mista (Dominante: UTP 189)
NUCLEO_315;Salinas, Taiobeiras;8;2;Sim;676;87.5;669, 676;Cadeia Mista (Dominante: UTP 676)
NUCLEO_316;Santa Cruz de Minas, São João del Rei;18;1;Sim;309;88.9;102, 195, 309;Cadeia Mista (Dominante: UTP 309)
NUCLEO_317;Santa Maria do Suaçuí, São Sebastião do Maranhão;4;1;Sim;684;100.0;684;Cadeia Coesa (100% interna)
NUCLEO_318;Santa Vitória, São Simão;6;2;Sim;546;66.7;546, 688;Cadeia Mista (Dominante: UTP 546)
NUCLEO_319;São Domingos das Dores, São Sebastião do Anta;2;0;Não;214;100.0;214;Cadeia Coesa (100% interna)
NUCLEO_32;Moju, Tailândia;2;0;Não;1;100.0;1;Cadeia Coesa (100% interna)
NUCLEO_320;São José do Jacuri, São Pedro do Suaçuí;4;0;Não;684;50.0;521, 684;Cadeia Mista (Dominante: UTP 684)
NUCLEO_321;São Romão, Ubaí;3;0;Não;417;66.7;257, 417;Cadeia Mista (Dominante: UTP 417)
NUCLEO_322;São Sebastião do Paraíso, São Tomás de Aquino;5;0;Não;241;80.0;112, 241;Cadeia Crítica (Núcleo Cross-UTP: 241, 112)
NUCLEO_323;Teixeiras, Viçosa;18;2;Sim;361;50.0;265, 361;Cadeia Mista (Dominante: UTP 361)
NUCLEO_324;Tocantins, Ubá;14;1;Sim;349;85.7;221, 349, 361;Cadeia Mista (Dominante: UTP 349)
NUCLEO_325;Turmalina, Veredinha;9;1;Sim;450;100.0;450;Cadeia Coesa (100% interna)
NUCLEO_326;Alegre, Guaçuí;3;0;Não;58;100.0;58;Cadeia Coesa (100% interna)
NUCLEO_327;Aracruz, João Neiva;3;0;Não;198;66.7;198, 92;Cadeia Crítica (Núcleo Cross-UTP: 198, 92)
NUCLEO_328;Atílio Vivácqua, Cachoeiro de Itapemirim;7;1;Sim;58;100.0;58;Cadeia Coesa (100% interna)
NUCLEO_329;Boa Esperança, Pinheiros;4;1;Sim;266;75.0;266, 769;Cadeia Mista (Dominante: UTP 266)
NUCLEO_33;Óbidos, Oriximiná;3;1;Sim;618;100.0;618;Cadeia Coesa (100% interna)
NUCLEO_330;Conceição do Castelo, Venda Nova do Imigrante;3;0;Não;58;100.0;58;Cadeia Coesa (100% interna)
NUCLEO_331;Irupi, Iúna;4;0;Não;214;50.0;214, 58;Cadeia Mista (Dominante: UTP 214)
NUCLEO_332;Itapemirim, Marataízes;5;0;Não;58;100.0;58;Cadeia Coesa (100% interna)
NUCLEO_333;Jaguaré, São Mateus;7;1;Sim;315;100.0;315;Cadeia Coesa (100% interna)
NUCLEO_334;Linhares, Sooretama;10;2;Sim;198;50.0;198, 315, 92;Cadeia Mista (Dominante: UTP 198)
NUCLEO_335;Serra, Vitória;7;1;Sim;363;100.0;363;Cadeia Coesa (100% interna)
NUCLEO_336;Barra Mansa, Volta Redonda;13;3;Sim;364;46.2;215, 280, 345, 364, 767;Cadeia Mista (Dominante: UTP 364)
NUCLEO_337;Cabo Frio, São Pedro da Aldeia;4;1;Sim;56;100.0;56;Cadeia Coesa (100% interna)
NUCLEO_338;Duque de Caxias, Rio de Janeiro;15;1;Sim;284;100.0;284;Cadeia Coesa (100% interna)
NUCLEO_339;Itaperuna, Laje do Muriaé;9;1;Sim;49;100.0;49;Cadeia Coesa (100% interna)
NUCLEO_34;Ourilândia do Norte, Tucumã;4;1;Sim;619;100.0;619;Cadeia Coesa (100% interna)
NUCLEO_340;Itatiaia, Resende;4;1;Sim;280;100.0;280;Cadeia Coesa (100% interna)
NUCLEO_341;Macaé, Rio das Ostras;10;2;Sim;201;50.0;201, 56, 68;Cadeia Mista (Dominante: UTP 201)
NUCLEO_342;Miguel Pereira, Paty do Alferes;2;1;Sim;245;100.0;245;Cadeia Coesa (100% interna)
NUCLEO_343;Miracema, Santo Antônio de Pádua;5;1;Sim;300;100.0;300;Cadeia Coesa (100% interna)
NUCLEO_344;Niterói, São Gonçalo;6;0;Não;284;100.0;284;Cadeia Coesa (100% interna)
NUCLEO_345;Paraíba do Sul, Três Rios;5;1;Sim;345;80.0;189, 345;Cadeia Mista (Dominante: UTP 345)
NUCLEO_346;Adamantina, Lucélia;6;1;Sim;3;100.0;3;Cadeia Coesa (100% interna)
